rt_id,who_was_rt,content_of_rt
1288858439389794306,tah_viapiana,"Michelle Bolsonaro está com Covid-19, diz Planalto. Resultado do exame da primeira-dama deu positivo dias depois de o presidente Jair Bolsonaro ter anunciado que se curou da doença. Estado de Michelle é bom, informou a Presidência. https://t.co/wB9k2MdUYu"
1288624409289330689,BolsonaroSP,"A questão é simples. Thammy nasceu menina, cada célula dela tem cromossomos XX - e nenhuma cirurgia muda isso. Nesta condição ela só poderia engravidar, logo, ser mãe.

Uma ideologia não pode estar acima da ciência. E pior, querer me obrigar a aceitar isso.

Abraço. https://t.co/NC3tp9t1rB"
1288870783004160003,revistaoeste,"Piada? PT quer criar a CPI da cloroquina para investigar se Bolsonaro ""faz uso político"" do medicamento https://t.co/mQ19kPIEDg"
1288854686792142848,g1,"Michelle Bolsonaro está com Covid-19, diz Planalto https://t.co/Y7TOf8KmA3 #G1 https://t.co/3GriVcr22V"
1288816212848369665,BolsonaroSP,"ANTES TARDE DO QUE NUNCA: Pref. SP Bruno Covas autoriza cloroquina.

Resta saber se Dória também cairá na real de que vidas estão acima de política, que para uma doença nova não existe remédio testado e que toda tentativa de cura é válida. Ou seguirá arrotando ciência, ciência? https://t.co/gldJYtiNed"
1288561524840304640,MiguelNicolelis,"EUA acabam de atingir a marca de 150 mil vítimas fatais pelo Covid19.
Brasil segue firme para chegar a 100 mil fatalidades em breve.
Qquer semelhança NÃO é mera coincidência!"
1288871029742489600,RevistaCrusoe,Michelle Bolsonaro testa positivo para Covid-19. https://t.co/qKqGDiebWg
1288959884298539011,felipeandreP1,@marcelo_semer 90 mil não é menos que 1 milhao?
1288818846728683521,JornalBSM,"Caso você não tenha lido:
Em entrevista ao BSM, infectologista Francisco Cardoso diz que a cloroquina salva vidas e tem eficácia comprovada cientificamente.https://t.co/O3QUUuzTlC"
1288927846065348608,SenadoFederal,O @senadorhumberto lamenta recorde de mortes e acusa descaso do governo https://t.co/8KI56nJONq https://t.co/WBMiaBipYQ
1288624409289330689,BolsonaroSP,"A questão é simples. Thammy nasceu menina, cada célula dela tem cromossomos XX - e nenhuma cirurgia muda isso. Nesta condição ela só poderia engravidar, logo, ser mãe.

Uma ideologia não pode estar acima da ciência. E pior, querer me obrigar a aceitar isso.

Abraço. https://t.co/NC3tp9t1rB"
1288813886553161730,Astro_Pontes,"Acabei de receber teste positivo para o novo coronavirus. Estou bem, só um pouco de sintoma de gripe e dor de cabeça. Agora em isolamento. Vai dar tudo certo. Sigo cumprindo minha agenda de forma remota e, obedecendo o período de distanciamento social para plena https://t.co/plE9uZF0bv"
1288880708673560584,MarceloBackes_,"A “eficácia”
da cloroquina
em uma metáfora.

https://t.co/ZaUlVxQfN8"
1288951804663914496,jeremiaswernek,"Morreu Marco Bobsin, vice-presidente do Grêmio, em decorrência de sequelas da Covid-19 https://t.co/ayYiV5uPf0 via @UOLEsporte @UOL"
1288854686792142848,g1,"Michelle Bolsonaro está com Covid-19, diz Planalto https://t.co/Y7TOf8KmA3 #G1 https://t.co/3GriVcr22V"
1288624409289330689,BolsonaroSP,"A questão é simples. Thammy nasceu menina, cada célula dela tem cromossomos XX - e nenhuma cirurgia muda isso. Nesta condição ela só poderia engravidar, logo, ser mãe.

Uma ideologia não pode estar acima da ciência. E pior, querer me obrigar a aceitar isso.

Abraço. https://t.co/NC3tp9t1rB"
1288952132742328321,lindberghfarias,Não podemos aceitar que o prefeito exponha crianças e professores a um risco conhecido.
1300217054432243712,JuliaMe75489206,TCU investiga rastro deixado por Mandetta e revira contrato milionário https://t.co/kU5sdIYtVV
1299868475842867201,ClioAparecidoG2,Lógico que não https://t.co/oceCzzmBzm
1300029890075426816,K13PT,"O maior golpe da história. 
Onde esta a cicatriz da facada?
Não digam que ele tem facilidade para cicatrização, o abdômen dele parece a cara do Frankenstein. https://t.co/GTMLTfrKon"
1300212037772103688,PedroMottaB,"Regina Duarte cai de cara no chão, na rua, e quebra três dentes. https://t.co/sjDjZ18zyS via @a_postagem"
1299820128062918656,felipeneto,"Botafogo não consegue fazer gol, o VAR não deixa UM entrar.

Chamar nesse lance é um absurdo! E o juiz é um covarde."
1300207790443687936,JornalDaCidadeO,"""É ciência... É ciência... Só trabalho com o que é ciência.""

https://t.co/Wra5xZL8S0"
1300208894292221954,CarlaZambelli38,"Mas é óbvio que eu apaguei o post na qual digo q fui curada da COVID!

Mas fiquem tranquilos, jornalistas de fofoca, se e qdo eu pegar COVID, me tratarei NOVAMENTE de forma PRECOCE e com Cloroquina.

E em sobrevivendo (sei q muitos torcem contra), postarei novamente a mesma foto!"
1300204641762848770,biabionica,Espero que o Bozo ponha pra fora e comece a mijar em jornalistas daqui pra frente.
1300184517228064769,flaviocostaf,"Praia de Ipanema, Rio de Janeiro. Domingo, 30 de agosto. Dá até pra ver o Covid no ar. https://t.co/9vTZ1kblGb"
1300080973120299008,JornalOGlobo,Regina Duarte sofre queda na rua e quebra três dentes: 'Aterrissei de boca no chão' https://t.co/eRwmn0NoC4
1299738717041483777,JornalOGlobo,"Sem máscara e com aglomeração, Bolsonaro inaugura usina em Goiás https://t.co/CZnYJLFQno"
1300193896685875202,Guine_SPFC,"Como disse o Marco Antônio Villa:

""Essa caterva vai fazer campanha contra a vacina...""

Eita bando, basta tocar o berrante que eles seguem em rebanho. https://t.co/zw7vA6MQwm"
1299121454559252480,paulo_venicius,@heriko @opropriolavo Eu me curei falando mal do Bolsonaro na internet.
1300063863556235264,xicosa,É ditadura q chama? https://t.co/TWvBdhCagH
1299881027150606336,nilmoretto,"Tenho pra mim que tapioca libera endorfina. 
*Ainda não tenho sustentação científica pra isso, mas seguirei fazendo testes."
1300176465787604992,Estadao,Praias do Rio lotam neste domingo mesmo com proibição por causa da covid-19 https://t.co/U2CEktxWNn
1243289356397314054,ronaldocaiado,"Eu sou médico, homem que sempre defendeu e acreditou na ciência para salvar vidas. Deus me poupou do sentimento do medo e tenho coragem para enfrentar os problemas que afligem os goianos. Sei de minhas responsabilidades e, em 1º lugar, está vida dos mais de 7 milhões de goianos. https://t.co/M8IGIPMEM3"
1300091047717081088,Marcoslulaofici,"Pronto, agora o GADO já pode vim aqui MUGI!😂BABACAS KKK

#BolsonaroTeEnganou https://t.co/lkpK6sisfy"
1300066002395250688,JornalOGlobo,Importação de armas caminha para recorde no atual governo https://t.co/FMCrppASpp
1300105749985550336,g1,Regina Duarte cai em calçada de SP e quebra 3 dentes https://t.co/nKd8MBg9HG #G1 https://t.co/KU2GDZ7GQ6
1300177336726441984,Fhilippuss,Acabei de descobri que mamãe me deu um remédio sem eu saber pq a porra do filho da puta do presidente disse. Eu estava péssimo e era por conta disso
1300174975773609985,bbcmundo,"Una iglesia vendía dióxido de cloro como solución milagrosa para el coronavirus. 

https://t.co/eEvaJ59FQX"
1300155342245056514,CarlosSergioRo7,"@GenSantosCruz 
@ptbrasil @STF_oficial @MPF_PGR @ALEXAND62138825 
Qdo. passar o caos, devem investigar quantos morreram por usar a cloroquina. 
""Quando combinada com o antibiótico azitromicina, a hidroxicloroquina pode aumentar a mortalidade em até 27%""

https://t.co/dDWJX809QJ"
1300125437893455872,salimmattarBR,"Temos 2 classes de cidadão: nós os pagadores de impostos e os privilegiados deputados estaduais do Piauí. Em meio a crise a Assembléia vai reembolsar aos deputados com covid as despesas de tratamento hospitalar, passagem aérea e hospedagem fora do estado para até 2 acompanhantes."
1300172692088381440,Estadao,Regina Duarte relata que quebrou três dentes após cair em calçada (via @Emais_Estadao) https://t.co/UP1fsFUMIS https://t.co/DNFxArIF1n
1300172022044143616,OZendao,"Renato támanjando pra caralho de futebol.
Parece médico que receita cloroquina."
1300101300995133440,RDL2001,Já temos dois a serem responsabilizados pelo que está acontecendo no RJ : Fachin e este traste 👇🏻 https://t.co/LQZ9whVz24
1299667066925047808,BrazilFight,"""Jamais menti sobre meu teste"", diz Carla Zambelli após boletim de hospital https://t.co/hbLz38vHgB via @UOLNoticias @UOL"
1300167348129804289,explicaacritica,"Hoje, após recentes incidentes, a OMS confirma que cigarro Malboro e Narguilé não são eficazes contra coronavírus. https://t.co/erqnEFOU7G"
1299797294032748546,helomarilac,"@majorolimpio Gratidão também é uma coisa que se presa no homem de bom caráter e isso o senhor desconhece. 
Tu se queimou demais por conta da sua ingratidão, agora nada do que fale será levado em consideração."
1292072367175458816,AbrahamWeint,"Show de horror em 99 SEGUNDOS. Sugestões ao ""escovinha"" mal criado e arrogante: Chame uma pessoa mais velha de senhor e NUNCA a interrompa. Gaste mais tempo lendo do que penteando-se. Quanto à burrice: tenha mais sorte na próxima encarnação. https://t.co/RvPLmqD75D"
1299860678719737858,OliverStuenkel,"Em 2 anos, a maconha poderá ser um dos principais produtos de exportação do Uruguai. Decretos assinados pelo presidente de centro-direita Lacalle Pou destravam exportações. Potencial da cannabis é considerável e pode chegar a US$ 500 milhões até 2022.  https://t.co/CXISAAnXA2"
1300082316371464192,RafaelFontana,"1. Todo mundo está usando máscara.
2. A contaminação continua.
- CONCLUSÃO: a máscara não serve para nada."
1300102169430036482,PriscilaDalcin,"Se todo mundo usa a focinheira e mesmo assim o contágio pelo comunavírus continua, de quem é a culpa?"
1300140259464880128,PagTeorias,A cloroquina que o Bolsonaro quer nos dar é um fungo zumbi e uma revelação bombástica sobre Jair Messias Bolsonaro 😨😨😨😱😱😱😱😱😱😱: https://t.co/5x9ytukMRD
1300085230649446401,vieneinpace,"brazil culture:
- pegar a prima
- dirigir o carro bêbado para levar o vô de 95 anos pra casa depois do almoço de domingo
- não usar cinto de segurança
- máscara no queixo
- ""tem um esquema aqui pra não precisar pagar""
- votar em bandido
- catupiry"
1299838728513478657,marcelo_semer,"Cloroquina é a cura ideal pra Covid tipo Zambelli, aquela que não pegou."
1300141446595575819,em_com,"Há 3 grandes linhas de pesquisa que buscam a cura para a COVID-19
https://t.co/aOMnKwXTj0"
1299525989362434048,Gilsond68246801,"@CarlaZambelli38 @rededor Deputada. O que importa se o 2o teste deu negativo ou positivo ou vice versa.  Importante que a Sra seguiu todos os protocolos, para proteger o seu semelhante. Vamos em frente!"
1299938505032953856,PatoviskFederal,"e a porra do argumento da pessoa é uma pesquisa da oms que mostra que pessoas ainda fazem festas &gt;MAS&lt; ela esquece o senso comum que pessoas tem famílias com trabalhadores e idosos que estão muito mais sucetiveis ao vírus.
Vamos fazer uma hipótese, você ia gostar se você fosse + https://t.co/d8YFMOcfxP"
1300055049427718146,Clauwild1,Detalhe: a obesidade é um dos maiores fatores de risco para a severidade da COVID-19. Da série “Si-en-ça - Si-en-ça - como morrer em casa”. https://t.co/INf53fv7d9
1299809445199974401,OrlenysOV,"Hoy confirmamos mi contagio de COVID-19.

Varios días con pérdida de gusto y olfato (síntoma infalible). Ya los estoy recuperando, pero el virus sigue activo. No tengo algún otro síntoma.

Aislamiento en curso.

Nunca bajé la guardia, así que cuídense más.

Les abrazo. 👊🏽🌹"
1300115585209110528,g1rio,Banhistas ignoram proibição e ocupam areias em domingo de sol no Rio =====&gt;https://t.co/xoaXQC7QGx #G1Rio https://t.co/WO8Q9gZoml
1300123266074451970,bahiadedireita,Cadê a vacina cubana? https://t.co/2BKeADiY4F
1300115585209110528,g1rio,Banhistas ignoram proibição e ocupam areias em domingo de sol no Rio =====&gt;https://t.co/xoaXQC7QGx #G1Rio https://t.co/WO8Q9gZoml
1299905170592194566,douglinz,boate p**** o terror da oms
1299761179510927365,Biakicis,Irresponsáveis e mentirosos. Resumindo: esquerdopatas. https://t.co/aQRWxqlnty
1300118219127173123,BlogdoNoblat,"“Aterrissei de boca no chão. [...] Foram 16 pontos em 3 camadas do epitélio que fiz questão de assistir depois de quatro tubos de anestesia e sem sentir um pingo de dor"". (Regina Duarte, sobre a queda que levou. Perdeu 3 dentes. Nada a ver, pois, com sua adesão a Bolsonaro) https://t.co/BNtTRWk4Ug"
1300105749985550336,g1,Regina Duarte cai em calçada de SP e quebra 3 dentes https://t.co/nKd8MBg9HG #G1 https://t.co/KU2GDZ7GQ6
1300020990920056832,AttuchLeonardo,"Quatro anos depois do golpe de 2016, os tucanos começam a chegar à conclusão de que o teto de gastos foi uma roubada https://t.co/vZD0lTB5Vq"
1299717907040083973,ronaldocaiado,"O poder não mudou o homem @jairbolsonaro. Um homem simples, corajoso e determinado que segue os princípios que o moveram até o momento: o bem do povo brasileiro."
1299519347463987200,Victorlyam,E choca um total de zero pessoas. Tudo teatro pra fazer campanha para acabar como estoque de cloroquina https://t.co/6PZzkVfO3G
1300082338400014338,Iizziebennett,amo o conceito de bolsominion achar que covid é brincadeira aí começa a passar mal e o c* trança que não passa nem vento
1298894023890030592,OECD,"The #COVID19 pandemic has triggered one of the worst #jobs crises since the Great Depression. 

See the key facts &amp; figures from our latest analysis 👇 https://t.co/2DSwfJoqcx #EmploymentOutlook https://t.co/hiBx7fNR0y"
1299900361831051264,lucasmourao_,O print. https://t.co/DLBJkGIWbN
1299811944170434561,ElNacionalWeb,Cuba: Tratarán el coronavirus con ozonoterapia vía rectal #ENMundo https://t.co/VgcC8lcnBs https://t.co/Xn1rYjsy85
1299701637058039813,MarceloBackes_,"ESTILHAÇOS 
Que genial, a cloroquina,
curou a Zambelli
da Covid que ela não tinha."
1300027988885504003,ancapsu,Não posso deixar de contribuir com a tag #AglomeraBrasil Todo mundo já percebeu a farsa completa que é essa fraudemia.
1300080973120299008,JornalOGlobo,Regina Duarte sofre queda na rua e quebra três dentes: 'Aterrissei de boca no chão' https://t.co/eRwmn0NoC4
1300075763044151298,eliseuneto,K A R M A https://t.co/xSxbgdel8A
1299966909300043777,solanbatista,Cloroquina atrapalha a propina #BolsonaroOrgulhoDoBrasil https://t.co/5s0wC0Ehev
1299901854306807808,prensacom,"Xavier Sáez- Llorens y Javier Nieto consideran que lo que realmente ayudó a mejorar el escenario fue la masiva trazabilidad en comunidades, que permitió identificar los casos y aislarlos. https://t.co/ycIpX1Osk8"
1310884873809399809,PauloMartins10,"Bom dia. 

57 MANDADOS DE PRISÃO POR DESVIOS NA SAÚDE DE SÃO PAULO https://t.co/SqpKOFMy1x"
1310681672996847618,bomdiajaider,"Homem que pegar a COVID-19 terá atrofia de 2cm de pau. 

Espalhem."
1311024518727639040,omelete,The Good Doctor enfrentará Covid-19 na quarta temporada; confira teaser https://t.co/3NvStHFqFY https://t.co/TErcszXgEG
1311031677767110657,UOL,Anitta critica atuação de Bolsonaro com incêndios: 'Não está fazendo nada' https://t.co/XbZYpc9HWh
1311044171814371328,hey_mika,"Gente, e Sherlock Holmes que tá nos TTs porque aparentemente as pessoas não sabiam que é um personagem fictício????"
1310962671454306304,JornalOGlobo,"Proposta de Renda Cidadã atende cálculo político de Bolsonaro, mesmo se não vingar https://t.co/lvNqjBHHN9"
1309941869988769793,AlineTosin,“Se ele for ruim a gente tira” https://t.co/nlZCeIunwg
1311045085270814721,g1,"Bolsonaro sanciona lei com pena maior, de até cinco anos, para maus-tratos contra cães ou gatos https://t.co/fqR9gZ6tFA #G1 https://t.co/sDO7Qj1Xip"
1311045061140979714,XeroxHolmes4,"Deixa eu ver se eu entendi  bem ! 
Demonizaram  a Cloroquina pq não havia estudos científicos que que comprovassem a sua eficácia, e agora querem injetar essa porcaria em nós mesmo sem  resultados clínicos conclusivos🤔🤔

VSF seu FDP 🖕🖕🖕🖕 https://t.co/HsnwElaXiI"
1309895267563470849,gen_heleno,HELENO RETOMA ENCONTROS EM QUE FAZ RELATOS SOBRE GOVERNO E FAMÍLIA BOLSONARO PARA A CASERNA. Título de matéria do jornalista Guilherme Amado. MENTIRA DESCARADA. JAMAIS ACONTECEU. Impressionante como o jornalismo de cabresto perdeu o respeito pela verdade. Muito triste.
1310954855842840583,hwgmelody,"Mano, o chan disse que o namjoon é um dos melhores líderes e que vê ele como um modelo, então começou a dizer que ele é muito legal e inteligente

Chan    🤝    namjoon
      Best leaders

Ai como e bom ser armystay
 https://t.co/FbGyDLEMY5"
1311034572692484096,Estadao,1 MILHÃO DE VIDAS PERDIDAS: Como o coronavírus avançou nos países mais castigados pela covid-19 ao longo dos 9 meses de pandemia? 👇 Acompanhe no gráfico e leia o especial em https://t.co/UjmTWvpATK https://t.co/9ATSDPA2ts
1310744767899357192,LUIZPATRIOTA39,"COMO CHEGAMOS A UM MILHAO DE MORTOS PELO CORONAVIRUS TENDO A CLOROQUINA QUE CURA 100% DOS CASOS?? 🤔🧐 

OU A CLOROQUINA NAO FUNCIONA OU O MUNDO INTEIRO ESTA CONTRA O BOLSONARO 😎🇧🇷🇱🇷"
1311012477556142082,o_antagonista,"Pazuello veta divulgar cloroquina em 'dia D' contra Covid-19, diz jornal. https://t.co/kGwuduKYL1"
1310685849697173504,jornalveracruz,Bolsonaro: “Milhares de vidas poderiam ter sido salvas” https://t.co/P14hVNpV4o
1310925459224440832,albuquerque_af,"O populismo exterminou a abertura de capital de várias empresas esse mês

A grande maioria das empresas iam captar para aumentar investimentos, gerar empregos e pagar mais impostos

O abalo de confiança é disseminado, não há mais espaço para errar dessa forma."
1310601334211698688,jairbolsonaro,"- Sociedade Européia de Cardiologia afirma: o uso da Hidroxicloroquina não causa arritmia.
- Milhares de vidas poderiam ter sido salvas caso a HCQ não tivesse sido politizada.

. Link no YouTube: https://t.co/pCbFy1LLVk https://t.co/jksXNmzrcf"
1310960162484748289,jornalextra,"Grupo Boticário não usará mais 'Black Friday': 'respeitando os que sentem desconforto com o termo', diz CEO https://t.co/ydzpNBCBHX https://t.co/XgIiHHoRHI"
1310628569085890562,FMouraBrasil,"Dom Bolsonaro del Centrão. Antes e depois. Minha edição especial, que ilustra o título do meu artigo: https://t.co/iUembms1jA. https://t.co/znrcn1XQIm"
1311000015742078976,UrbanNathalia,"O Sinn Féin sempre apoiou abertamente as lutas anti-imperialistas na América Latina, e sempre mantiveram um laço de união e amizade para com os que conduzem essas lutas. Agora, o Sinn Féin nomeou a brigada de médicos cubanos para o Prêmio Nobel da Paz de 2021 ✊🏽✊🏽✊🏽 https://t.co/gAZ27w83oI"
1310993967606124545,gguklovemaze,"não resisti 
#btsfanart #jungkook #yourartstell @bts_twt https://t.co/v9K671Busu"
1310994128331735047,exame,"#News: Um spray nasal feito com o composto chamado INNA-051 conseguiu freiar a replicação do #coronavírus em 96% em testes de laboratório!

https://t.co/YUTolOyHoU"
1305975154061774848,AiltonBenedito,"Mundo 'errou' ao recomendar que pacientes esperassem ter falta de ar, diz secretário da Saúde do CE sobre a pandemia de Covid-19. Entretanto, a verdade é que o 'erro' grotesco foi exclusivamente dos promotores da “ciência, ciência, ci ênnn cia!”, “foco, foco, foco!”. https://t.co/rIXYpapbih"
1310950831504732163,GalizaAr,Essa criatura não pode mais ser chamado de “governador “! ... Tem que ser “impichado”!#ForaDoria https://t.co/0PWMruAb3j
1310968226327789569,GreysABrasil,Meredith Grey em primeira foto promocional da 17ª temporada de #GreysAnatomy! https://t.co/cq5z55yMVa
1310972494870990849,marivarella,“Dia D” agora terá aula virtual sobre tratamento precoce c/ cloroquina https://t.co/DaYyQElwR0
1310952073102602241,CarlaZambelli38,ATENCÃO! https://t.co/L4r3injQvQ
1310767902988132352,WalterSena,Um país que tem tudo pra dar certo. https://t.co/w9hlDc4hL0
1310966402254336003,alimerosa,gente é vdd esses boatos de que o prefeito falou que coronavírus já acabou? pq se for sinceramente @deus porque me fizeste resplendorense?
1310905834143088641,policiafederal,"A PF está nas ruas, junto com @CGUonline e a Polícia Civil, para desarticular ORCRIM dedicada a desvios de recursos públicos na área da #saúde.
São investigados contratos que envolvem mais de R$ 1 bilhão em recursos públicos.
Saiba mais: https://t.co/rfRszSdgx0 https://t.co/KcirytHu0H"
1310641691431448577,alexandregarcia,Uma história de amor que rompeu uma distância oceânica. E na Sociedade Europeia de Cardiologia a derrubada do mito da arritmia no tratamento precoce da Covid. Quantos foram mortos pelos que impuseram o medo?  https://t.co/mQaQxAE3r0 via @YouTube
1310741903810285568,luizpaulor,Apreciem. https://t.co/GMtFKYVTFB
1310965442375290883,parlkjimins,mano o cara aqui na loja sabe q eu faco med e ta me perguntando sobre os remedios q a mae dele toma se eu acho q a dose ta errada
1310687799297875968,LiouvilleJoseph,@DolarBipolar Mas o dólar alto favorece as exportações. Nós estamos a caminho de virar um país rico com nossa venda de commodities mesmo com sua torcida contra. Nunca vimos uma economia brasileira tão pujante como a do Bolsonaro em seu primeiro ano.
1305983488907247617,CNNBrasil,"Denúncia aponta que o governo federal está em ""verdadeira campanha para a utilização de um medicamento ineficiente"" https://t.co/sOephGuYH5"
1310945927188959233,jmarcelomzz,Ah TÁ‼️Vamos fazer d conta q acreditamos👍🏻🤣🤣🤣 https://t.co/4oriiC2dhR
1310924212622823430,bbcbrasil,"Brasil tem a 6ª pior mortalidade (mortes a cada 100 mil habitantes) por covid-19 no mundo - atrás apenas de San Marino, Peru, Bélgica, Bolívia e Andorra. Acesse o mapa completo: https://t.co/TTegBlQVnx https://t.co/ZBiYZxbYDo"
1310892821923221504,JenoOliveiraa,Sociedade Européia de Cardiologia afirma: o uso da Hidroxicloroquina não causa arritmia. Milhares de vidas poderiam ter sido salvas caso a HCQ não tivesse sido politizada. Esse é de longe um dos períodos mais obscuros de nossa história.
1310895421028478981,jairmearrependi,"Duas ex-assessoras de Flávio Bolsonaro, que também eram dirigentes do PSL, fizeram repasses de seus salários ao advogado do chefe. 

Que gabinete engraçado, onde todo mundo trabalha pra não receber. É uma ONG. #FlavioNaCadeia 

https://t.co/DC8nFH5PpU"
1310713522121252864,UOLNoticias,"Bolsonaro: ""superbateria"" de nióbio e grafeno vai revolucionar indústria https://t.co/7CNBVVGXAH"
1310713522121252864,UOLNoticias,"Bolsonaro: ""superbateria"" de nióbio e grafeno vai revolucionar indústria https://t.co/7CNBVVGXAH"
1310634231375245313,BrazilFight,Sociedade Europeia de Cardiologia desmonta argumento dos negacionistas da cloroquina: “Não causa arritmia” (veja o vídeo) https://t.co/gJk72UtRIm
1310879243451224064,MelPitersburg,"Entao lindos... sexta feira estarei muito doente, peço pra comprarem pra mim :) https://t.co/b8EOTcSELh"
1310876550154387456,Elibela,"Vamos ensinar as pessoas a não votar em PARTIDO traidor, nem para vereador e prefeito. ESQUERDA/CENTRO NUNCA MAIS. Se começar com:
*
13(PT), 
65(PCdoB), 
50(PSOL),
21(PCB), 
18(REDE),
16(PSTU), 
40(PSB), 
12(PDT), 
29(PCO), 
25(DEM), 
15(MDB), 
45(PSDB), 
NÃO VOTE! É FURADA!"
1310684055441113096,UOLNoticias,Carol Solberg é denunciada por manifestação política contra Jair Bolsonaro https://t.co/DNgssDb3q8
1310614840822714377,FrankCastle2009,"Sociedade Européia de Cardiologia afirma: o uso da Hidroxicloroquina não causa arritmia.

140.000 mortes por culpa do STF, GLOBO, MANDETTA E GOVERNADORES."
1310776313259544576,g1,"Após festa, 12 estudantes de medicina testam positivo para Covid-19 em SP https://t.co/gMyquTrrV7 #G1 https://t.co/Sxb8VQ2WeA"
1310735622596943872,SepMcris,"Triste esse momento jamais vivido por mim ou por ninguém, pior é vc conviver diariamente, correndo todos os riscos e ver tanta gente que já superou o vírus e se aglomeram, não usam máscaras e pior, nem com óbitos de conhecidos, eles não se sensibilizam mais.."
1310682536281083904,jcsosazpurua,"Les recomiendo esta entrevista, donde mi hermano Andrés Fernando @AndresFS77 responde a preguntas vitales sobre el virus chino, sus implicaciones, disfraces, alcance y cuidados: https://t.co/HDvnGlq6Qe"
1310205973127139328,joganomeulean,"na bio do insta: futura advogada

no baile: https://t.co/uAAQr3aWsf"
1310713522121252864,UOLNoticias,"Bolsonaro: ""superbateria"" de nióbio e grafeno vai revolucionar indústria https://t.co/7CNBVVGXAH"
1310601334211698688,jairbolsonaro,"- Sociedade Européia de Cardiologia afirma: o uso da Hidroxicloroquina não causa arritmia.
- Milhares de vidas poderiam ter sido salvas caso a HCQ não tivesse sido politizada.

. Link no YouTube: https://t.co/pCbFy1LLVk https://t.co/jksXNmzrcf"
1310734707785490432,CNNBrBusiness,"Nesta segunda-feira (28), o presidente voltou a sinalizar o interesse em viabilizar a exploração de nióbio no Brasil https://t.co/YCVyIa1Ve0"
1310739737058201601,CrisMenshova,"@cristilobo Ah... Não!!!!
Com quem eu vou debochar?
Vc era a minha preferida!!!
😥😥😥"
1310634231375245313,BrazilFight,Sociedade Europeia de Cardiologia desmonta argumento dos negacionistas da cloroquina: “Não causa arritmia” (veja o vídeo) https://t.co/gJk72UtRIm
1310530037368729601,NandoColoradoZN,Alguém tinha alguma dúvida de que isso aconteceria? https://t.co/o1BDYUndKw
1310746113490604032,DiarioPE,Ministério da Saúde agora quer 'dia D' com 'aula virtual' a médicos sobre cloroquina https://t.co/kXZPYZqhWq https://t.co/seukp47zJ2
1322240017004191745,o_antagonista,Bolsonaro sobre eleições no Rio e em SP: 'A gente vai ganhar nos dois municípios'. https://t.co/lWeWdQxkbg
1322301223899406337,FDicro,"@KayaNakamura @revistaoeste @taoquei1 Eu entendo a dificuldade que analfabetos funcionais como vc tem de interpretar um simples texto, por isso vou relevar. Quem foi que disse que hidroxicloroquina previne o covid? Você sabe a diferença de tratamento para profilaxia, né?"
