rt_id,who_was_rt,content_of_rt
1244740868290076672,FlavioBolsonaro,"Proposta inicial para pagar renda mínima a trabalhadores informais foi de R$200,00. Câmara propôs aumentar para R$ 500,00. Presidente @jairbolsonaro foi mais justo e autorizou R$ 600,00 (via emenda do deputado @MajorVitorHugo ). Parabéns a todos. #PagaLogoBolsonaro"
1244692133417803780,jairbolsonaro,"Laboratório químicos das Forças Armadas ampliam produção de cloroquina: Laboratório Farmacêutico da @marmilbr, Laboratório Químico Farmacêutico do @exercitooficial e Laboratório Químico Farmacêutico da @fab_oficial, todos localizados no Rio de Janeiro (RJ)."
1244772762390052865,jnascim,"Nicolas Maduro com erva-cidreira e Bolsonaros com a cloroquina, todos a 80 km/h https://t.co/YjG22i0epz"
1244437600842153984,SoniaBridi,"Aqui a reportagem sobre a busca de tratamento para Covid 19. E não, hidroxicloroquina NÃO TEM EFICÁCIA COMPROVADA AINDA! https://t.co/ec8CyRhHFo"
1244770305337417730,DamaresAlves,"Hoje conversei com a ministra da Família e de Igualdade de Oportuniades da Itália para prestar toda a solidariedade e apoio que aquele país tanto precisa neste momento.

O governo @jairbolsonaro cuida para que os brasileiros que vivem lá superem todas as adversidades. 🇧🇷♥️🇮🇹 https://t.co/FyCh9Jda2m"
1244613557980971008,BolsonaroSP,Dia triste para quem torce pelo vírus. A FDA (=ANVISA dos EUA) liberou o uso da cloroquina em pacientes com coronavírus. Certamente se fosse um familiar nosso autorizaríamos o seu uso.
1244753224776790019,ElSabuesoAP,"Sí, la @FDAenEspanol emitió una autorización para que los productos de sulfato de hidroxicloroquina y fosfato de cloroquina sean distribuidos y recetados a pacientes hospitalizados con COVID-19. https://t.co/AQjvilb3kM"
1244408585980981250,franko67_0,"Feliz noche apreciado Tuiteros estoy mal de Salud a mi esposa y a este Tuitero nos diagnosticaron #Paludismo y por aquí en este sector hay varios Vecinos con lo mismo en San Jose de Guanipa Anzoátegui,  Ninguna autoridad sean a Personado a fumigar OJO. @MPPSalud @Mippcivzla .!!"
1244639185962766336,ArthurWeint,"Tv marinho: ""cloroquina é perigosa, e já matou gente que tomou"".

Tv marinho: ""cloroquina é essencial para quem tem lúpus e reumatismo"".

Pra um caso, pode matar. Para outros, é a salvação. Será que se o presidente fosse de esquerda, os marinho estariam louvando a cloroquina?"
1244639185962766336,ArthurWeint,"Tv marinho: ""cloroquina é perigosa, e já matou gente que tomou"".

Tv marinho: ""cloroquina é essencial para quem tem lúpus e reumatismo"".

Pra um caso, pode matar. Para outros, é a salvação. Será que se o presidente fosse de esquerda, os marinho estariam louvando a cloroquina?"
1243628671056916480,ufrgsnoticias,"Veja os riscos da automedicação da hidroxicloroquina, um medicamento com venda sob prescrição que pode causar reações adversas, aumentar toxicidade na interação com outros medicamentos ou reduzir efeito de tratamentos - Material da Faculdade de Farmácia: https://t.co/fZQB2n4yOB https://t.co/JoMOSIOoiw"
1244737546610851841,EileenOrmsby,"I guess it was inevitable that opportunistic vendors on the darknet markets would jump on Trump's claims of a #COVID19 ""cure"". Be safe out there #darkweb https://t.co/Aq6Fw4Ybth"
1244764956018585600,CarlaZambelli38,"- Teste com cloroquina na Itália dá resultado positivo.

- EUA permitem uso emergencial de 30 milhões de doses de cloroquina.

- Após testes como preventivo, Índia proíbe exportações de cloroquina.

- Vas Narasimhan, CEO da suíça Novartis: ""Cloroquina é a maior esperança"".

🙏"
1244489837522141184,IDL_R,"El protocolo aceptado solo considera el uso de estos medicamentos en el “manejo de casos moderados y severos (solo pacientes hospitalizados)”, que no está de acuerdo con las mejores experiencias reportadas, que recomiendan un uso temprano de los medicamentos. https://t.co/qYaTKXRD1N"
1244722307828002818,manfredini_cris,Diariamente as definições de idolatria e imbecilidade são atualizadas por aqui. Pra mim a de hoje foi essa. https://t.co/jFImFt0hhZ
1244762339292909575,ChalecosAmarill,"📽☣ #BOMBAZO Un hombre muere en #EEUU 🇺🇲 después de aplicarle el consejo médico de Trump quién sugirió cloroquina para tratar #COVID19.

👉""No crean nada de lo que dice ese presidente""
@rhm1947 @taniasandinista @YourMarkLubbers @DavidxCuba @GuerreroCuba  https://t.co/ZjVcVnnhWb"
1244762339292909575,ChalecosAmarill,"📽☣ #BOMBAZO Un hombre muere en #EEUU 🇺🇲 después de aplicarle el consejo médico de Trump quién sugirió cloroquina para tratar #COVID19.

👉""No crean nada de lo que dice ese presidente""
@rhm1947 @taniasandinista @YourMarkLubbers @DavidxCuba @GuerreroCuba  https://t.co/ZjVcVnnhWb"
1244692133417803780,jairbolsonaro,"Laboratório químicos das Forças Armadas ampliam produção de cloroquina: Laboratório Farmacêutico da @marmilbr, Laboratório Químico Farmacêutico do @exercitooficial e Laboratório Químico Farmacêutico da @fab_oficial, todos localizados no Rio de Janeiro (RJ)."
1244761133732581379,Rconstantino,"De olho em vc que implica com a cloroquina porque faltam estudos científicos, mas defende a ""maconha"" medicinal (incluindo, além do canabidiol, o THC, que não tem nada de medicinal)."
1244692133417803780,jairbolsonaro,"Laboratório químicos das Forças Armadas ampliam produção de cloroquina: Laboratório Farmacêutico da @marmilbr, Laboratório Químico Farmacêutico do @exercitooficial e Laboratório Químico Farmacêutico da @fab_oficial, todos localizados no Rio de Janeiro (RJ)."
1244324338259632128,diogomainardi,"Primeira vítima fatal da Bahia fez uso de cloroquina, diz jornal https://t.co/IJjGCv9UyK"
1243891468055576577,cavmota,"@TaschnerNatalia , do @iqciencia , explica os erros metodológicos graves do estudo francês que está sendo usado para defender o uso da cloroquina contra a covid-19 https://t.co/xiXnYVp93w"
1244645647808180224,filipebarrost,"Revista @exame:

A imagem que vocês publicaram é o Fosfato de Cloroquina, utilizado para LIMPEZA DE AQUÁRIOS. 

O que está sendo testado no tratamento do covid-19, é o HIDRÓXIDO DE CLOROQUINA. 

Apaguem a imagem sob pena de induzir milhões de pessoas a erro, matando-as. https://t.co/uHMMEOLeqA"
1244733398888873984,hipernoticias,https://t.co/YDJeTOxntD
1244692133417803780,jairbolsonaro,"Laboratório químicos das Forças Armadas ampliam produção de cloroquina: Laboratório Farmacêutico da @marmilbr, Laboratório Químico Farmacêutico do @exercitooficial e Laboratório Químico Farmacêutico da @fab_oficial, todos localizados no Rio de Janeiro (RJ)."
1244613557980971008,BolsonaroSP,Dia triste para quem torce pelo vírus. A FDA (=ANVISA dos EUA) liberou o uso da cloroquina em pacientes com coronavírus. Certamente se fosse um familiar nosso autorizaríamos o seu uso.
1244692133417803780,jairbolsonaro,"Laboratório químicos das Forças Armadas ampliam produção de cloroquina: Laboratório Farmacêutico da @marmilbr, Laboratório Químico Farmacêutico do @exercitooficial e Laboratório Químico Farmacêutico da @fab_oficial, todos localizados no Rio de Janeiro (RJ)."
1244745584323559424,diegoescosteguy,"“H1N1 foi muito mais terrível do que é o coronavírus”, diz o presidente. A informação é falsa, aliás. “Ninguém falou nada.”"
1244613557980971008,BolsonaroSP,Dia triste para quem torce pelo vírus. A FDA (=ANVISA dos EUA) liberou o uso da cloroquina em pacientes com coronavírus. Certamente se fosse um familiar nosso autorizaríamos o seu uso.
1244692133417803780,jairbolsonaro,"Laboratório químicos das Forças Armadas ampliam produção de cloroquina: Laboratório Farmacêutico da @marmilbr, Laboratório Químico Farmacêutico do @exercitooficial e Laboratório Químico Farmacêutico da @fab_oficial, todos localizados no Rio de Janeiro (RJ)."
1244730154376736768,dardogasparre,"Me salvé, como es obvio. Pero nunca olvido que mi vida estuvo gratuitamente en juego por una decisión estúpida de un gobierno. A cuánta gente, sin amigos en Panagra, les pasó, les pasa y les pasará lo mismo. Viva la libertad."
1244639185962766336,ArthurWeint,"Tv marinho: ""cloroquina é perigosa, e já matou gente que tomou"".

Tv marinho: ""cloroquina é essencial para quem tem lúpus e reumatismo"".

Pra um caso, pode matar. Para outros, é a salvação. Será que se o presidente fosse de esquerda, os marinho estariam louvando a cloroquina?"
1244729482889564166,LeilaneNeubarth,Delis Ortiz botando o dedo na ferida com a pergunta precisa na coletiva sobre coronavírus 👏🏼👏🏼👏🏼Parabéns !!!!!
1243960241311678465,CDCgov,NEW CDC Health Alert Network advisory: Severe Illness Associated with Using Non-Pharmaceutical Chloroquine Phosphate to Prevent and Treat #Coronavirus Disease 2019 (COVID-19). https://t.co/qFV5TyNifT https://t.co/NZhLu8jaO2
1244639185962766336,ArthurWeint,"Tv marinho: ""cloroquina é perigosa, e já matou gente que tomou"".

Tv marinho: ""cloroquina é essencial para quem tem lúpus e reumatismo"".

Pra um caso, pode matar. Para outros, é a salvação. Será que se o presidente fosse de esquerda, os marinho estariam louvando a cloroquina?"
1244704998316965888,republica_ctba,Forças Armadas aceleram produção de cloroquina no Brasil https://t.co/Ik1dL7jJoN
1244692133417803780,jairbolsonaro,"Laboratório químicos das Forças Armadas ampliam produção de cloroquina: Laboratório Farmacêutico da @marmilbr, Laboratório Químico Farmacêutico do @exercitooficial e Laboratório Químico Farmacêutico da @fab_oficial, todos localizados no Rio de Janeiro (RJ)."
1242263727325483010,RossFairchild,"A NY Doctor shared with Hannity his Hydroxy Chloroquine/Azithromycin results.
200mg 2x daily Hydroxy Chloroquine 
500mg 1x daily Azithromycin 
220mg 1x daily Zinc sulfate

350 patients 
• Breathing restored 3-4 hours
• Zero deaths
• Zero hospitalizations 
• Zero intubations"
1244727557766987778,BolsonaroSP,"Interessante relato de médico que obteve sucesso no uso da hidroxicloroquina associado ao antibiótico azitromicina,que atua principalmente nos pulmões:

""No momento que vivemos, a medicina se sobrepõe à ciência, porque estamos em guerra"".

*Via @JornalBSM

https://t.co/9LmMUhwfZT"
1244639185962766336,ArthurWeint,"Tv marinho: ""cloroquina é perigosa, e já matou gente que tomou"".

Tv marinho: ""cloroquina é essencial para quem tem lúpus e reumatismo"".

Pra um caso, pode matar. Para outros, é a salvação. Será que se o presidente fosse de esquerda, os marinho estariam louvando a cloroquina?"
1244639185962766336,ArthurWeint,"Tv marinho: ""cloroquina é perigosa, e já matou gente que tomou"".

Tv marinho: ""cloroquina é essencial para quem tem lúpus e reumatismo"".

Pra um caso, pode matar. Para outros, é a salvação. Será que se o presidente fosse de esquerda, os marinho estariam louvando a cloroquina?"
1244642876753088514,NoticiasONU,"Respecto a la #cloroquina , la OMS aclara que no hay un tratamiento específico contra el #coronavirus, aunque algunas sustancias dan buenos resultados contra ciertos síntomas.
Hay que tener cuidado de que no se agoten porque son necesarias para otras enfermedades. 
@DrMikeRyan https://t.co/OnN3fhRYk6"
1244639185962766336,ArthurWeint,"Tv marinho: ""cloroquina é perigosa, e já matou gente que tomou"".

Tv marinho: ""cloroquina é essencial para quem tem lúpus e reumatismo"".

Pra um caso, pode matar. Para outros, é a salvação. Será que se o presidente fosse de esquerda, os marinho estariam louvando a cloroquina?"
1244639185962766336,ArthurWeint,"Tv marinho: ""cloroquina é perigosa, e já matou gente que tomou"".

Tv marinho: ""cloroquina é essencial para quem tem lúpus e reumatismo"".

Pra um caso, pode matar. Para outros, é a salvação. Será que se o presidente fosse de esquerda, os marinho estariam louvando a cloroquina?"
1244692133417803780,jairbolsonaro,"Laboratório químicos das Forças Armadas ampliam produção de cloroquina: Laboratório Farmacêutico da @marmilbr, Laboratório Químico Farmacêutico do @exercitooficial e Laboratório Químico Farmacêutico da @fab_oficial, todos localizados no Rio de Janeiro (RJ)."
1244423295740641282,dacosss,@realDonaldTrump  hydroxychloroquine and chloroquine authorized by ANVISA (Brazilian FDA) with recommended amounts. https://t.co/giaxkestG0
1244705548458766342,MBelenMena,"Medicamentos esenciales en COVID 19  OPS Marzo 27/2020
Su acceso es elemento clave en el derecho a la salud. Poca plata, muchas necesidades: garantizar lo esencial!  https://t.co/7AqEJVwEA1 https://t.co/LHOjbnhiBr"
1244666477569101825,DZlia3,"O Samuel estava internado e receberá alta depois do tratamento com cloroquina.
Passem adiante. https://t.co/Hob4F5SZPt"
1244666791965712384,AAutoinmunes,"🔊🔊 Con motivo de la Nota Informativa en la que la Agencia Española del Medicamento @AEMPSGOB difundía contenido sobre la distribución controlada de #hidroxicloroquina #Cloroquina para garantizar que los pacientes con enfermedades crónicas, dispongan de su medicación.
 👇 #hilo https://t.co/lYdEI5HABb"
1244718833757302784,RobertW19699826,"Trussville | BREAKING: FDA issues emergency use authorization for chloroquine, hydroxychloroquine for COVID-19 patients https://t.co/sE8Afjur2m MAYBE A LAST RESORT AT THIS TIME."
1255642456567296007,kimpkat,"O apresentador sempre defendeu o presidente Jair Bolsonaro ao minimizar o impacto da pandemia no país. Desejo que melhore logo e possa voltar o mais rápido possível para a TV.

#BolsonaroÉCulpado #DireitaQuerImpeachment

https://t.co/tXrjYnUhWb"
1255438774684745731,jairbolsonaro,". Mais ações do @govbr entre 24/4 a 27/04/20:

1- Início das entregas de soluções NACIONAIS para respiradores;

2- R$ 163 milhões da saúde para habilitação de 1.134 leitos de UTI pelo Brasil;

3- Maior produção de etanol da história: 35,6 bilhões de litros na safra 2019/20;"
1255623800982589446,BolsonaroSP,"Boa notícia. Novo remédio para combater o COVID-19 no horizonte.

O remdesivir pode, segundo o Dr. Fauci, bloquear uma enzima que o vírus utiliza. https://t.co/it6GOwwRsk"
1255612083649097728,folha,Casos de Covid-19 aumentam 173% em Blumenau após reabertura do comércio https://t.co/OlLWxPfcBr
1255543145187737603,delucca,"""É lógico que isolamento social ainda é uma forma de proteção. Quem pode ficar em casa, que fique, mas quem não pode que acredite e confie num presidente sério, honesto e que tem pulso"" 

- deputada federal Major Fabiana (PSL) https://t.co/NMihEX1sXF"
1255536460339515393,carteiroreaca,Alguém sabe o nome dessa planta que a jornalista da Globo cultiva em casa? https://t.co/gkPV1xekES
1255608082681548802,Li_Positive,"E a Cloroquina??
Pararam de encher nossa TL com ela.
Justo agora q estão morrendo TANTAS pessoas.
As pessoas estavam tão convictas. Pareciam ""especialistas"" divulgando.
Cadê as # sobre Bolsonaro ter RAZÃO em relação a ela?
O q houve??? Desistiram dele ter razão??"
1255583884290465793,g1,Bolsonaro diz que governadores e prefeitos devem ser cobrados por mortes e critica isolamento com declaração que vai na contramão de estudos científicos =&gt; https://t.co/FI1L1JOMmj #G1 https://t.co/jye9SOPUNO
1255625008803655681,KarlMarxis,@BolsonaroSP Morreu o Papagado. https://t.co/2loHIQKFXt
1255596601751601158,DrLejarazu,"Algo de luz al final del túnel del tratamiento de #COVID19 :
Remdesivir: puede ser necesario administrarlo más precozmente. Algunos resultados.  https://t.co/t5TRc8eyFm"
1255620432826265601,CNNBrasil,"""Quem decidiu todas as políticas restritivas foram governadores, prefeitos, o Supremo [Tribunal Federal] que decidiu"", disse Bolsonaro. https://t.co/QXcoaz9U5C"
1255623800982589446,BolsonaroSP,"Boa notícia. Novo remédio para combater o COVID-19 no horizonte.

O remdesivir pode, segundo o Dr. Fauci, bloquear uma enzima que o vírus utiliza. https://t.co/it6GOwwRsk"
1255628063284453376,RevistaEpoca,EUA anunciam que antiviral remdesivir é eficaz contra a Covid-19 https://t.co/5SJPgNtXiT https://t.co/SkNhP47YTJ
1255533566253023233,TVMaresol,Porco Ed Motta testa positivo para coronavírus https://t.co/RX34t1B7kB
1254443198618927104,GuilhermeBoulos,"A desigualdade social de São Paulo escancarada pela Covid-19: 

Morumbi - 297 casos / 7 mortes.
Brasilândia - 89 casos / 54 mortes.

Quem tem condições trata, quem não tem morre."
1255628063284453376,RevistaEpoca,EUA anunciam que antiviral remdesivir é eficaz contra a Covid-19 https://t.co/5SJPgNtXiT https://t.co/SkNhP47YTJ
1255623800982589446,BolsonaroSP,"Boa notícia. Novo remédio para combater o COVID-19 no horizonte.

O remdesivir pode, segundo o Dr. Fauci, bloquear uma enzima que o vírus utiliza. https://t.co/it6GOwwRsk"
1255625787929231361,MariluPamc,"VAI TE EMBORA CARNIÇA!!!

Kataguiri sugere aliança com a esquerda para derrubar Bolsonaro - RENOVA Mídia https://t.co/kinGDQBcEv via @renovamidia"
1255623800982589446,BolsonaroSP,"Boa notícia. Novo remédio para combater o COVID-19 no horizonte.

O remdesivir pode, segundo o Dr. Fauci, bloquear uma enzima que o vírus utiliza. https://t.co/it6GOwwRsk"
1255623800982589446,BolsonaroSP,"Boa notícia. Novo remédio para combater o COVID-19 no horizonte.

O remdesivir pode, segundo o Dr. Fauci, bloquear uma enzima que o vírus utiliza. https://t.co/it6GOwwRsk"
1255623800982589446,BolsonaroSP,"Boa notícia. Novo remédio para combater o COVID-19 no horizonte.

O remdesivir pode, segundo o Dr. Fauci, bloquear uma enzima que o vírus utiliza. https://t.co/it6GOwwRsk"
1255623800982589446,BolsonaroSP,"Boa notícia. Novo remédio para combater o COVID-19 no horizonte.

O remdesivir pode, segundo o Dr. Fauci, bloquear uma enzima que o vírus utiliza. https://t.co/it6GOwwRsk"
1255623800982589446,BolsonaroSP,"Boa notícia. Novo remédio para combater o COVID-19 no horizonte.

O remdesivir pode, segundo o Dr. Fauci, bloquear uma enzima que o vírus utiliza. https://t.co/it6GOwwRsk"
1255621384199442433,maurobonna,https://t.co/Ssw68mRMoL
1255617119972134914,o_antagonista,"""Não subestimem a doença. É mais sério do que eu imaginava”, disse o apresentador, que não tem previsão de retorno à RedeTV!.

https://t.co/GmtM6cmNqw"
1255619577104470016,ppaly,São Paulo está batendo todos os recordes de infectados e mortos com o #COVID19. A quarentena foi mal feita e toda a gestão da pandemia está sendo muito fraca. Tanto o Doria qto o Covas terão que ser responsabilizados por isso. E não adianta tentar culpar o Bolsonaro. #coronavirus
1255558208120291333,seontasa,"Repórter conta drama do pai, Bolsonarista fanático, que não seguiu isolamento e está na UTI https://t.co/E2xrgS9Lwb"
1255603163010404356,renatabello,"A blogueira alagoana não não usa máscara mas se protege contra o coronavírus usando GUMMY HAIR. Sim, esse é o Tweet. https://t.co/ABtFwkkFQL"
1255482778218573830,delucca,Vocês notaram que a cloroquina saiu da narrativa política de Bolsonaro?
1255614816758177794,gpoli,Amigos da passagem de pano: alguém aí se lembra da campanha “O Brasil não pode parar”?
1255607768637210624,RodrigoMenegat,"Nem bem tivemos a boa notícia sobre os resultados do estudo com o Remdesivir, já temos más notícias: esse pesquisador de Yale aponta que as medidas de resultado foram alteradas durante a pesquisa. https://t.co/llHWCCBTq5"
1255549494667640834,MinEconomia,"“O Brasil tem ativos imobiliários que chegam a mais de R$ 1 trilhão de valor. Se acelerarmos a venda de imóveis, podemos reduzir bastante a dívida pública”, defende o ministro Paulo Guedes .Saiba mais: https://t.co/TSAtqMHKSK https://t.co/lSFp6cbnUs"
1255598715051618309,RenovaMidia,"Os mercados mundiais estão animados, nesta quarta-feira (29), após a farmacêutica Gilead Sciences afirmar que seu medicamento Remdesivir atingiu resultado positivo em testes contra o #coronavírus.

https://t.co/8ApkpEyric"
1255596198733524998,RaphaHauerKing,"Não sei quem é esse homem MARAVILHOSO, recebi essa receita por mensagem, e já quero ele vindo fazer kibe na minha cozinha.

#FiqueEmCasa #ReceitaDeKibe https://t.co/od8MfDE8X1"
1255601910326976512,roxmo,"Profissionais da saúde agora têm assinatura digital grátis e newsletter exclusiva https://t.co/yr9zlJeeAu // Olha só, mais gente vai receber a Folha de graça! Já são professores, advogados, médicos, enfermeiros... Será que vão ler?"
1255505219779256328,otempo,"Caio Coppola, comentarista da CNN Brasil, testa positivo para coronavírus https://t.co/QXz6eQnsHm https://t.co/bNfk0BGbCP"
1255499096644890624,erlan_bastos,#URGENTE O apresentador Sikêra Jr. está com os dois pulmões comprometidos por causa do novo coronavírus. Informação dada pela rede tiradentes de Manaus. Mais informações em instantes no @mixturando https://t.co/n6CER2ZuGw
1255492982389735430,paulomoreria,"quarentena dia 45: se tivesse que por um nome de remédio pro teu filho/filha, que nome tu escolheria?"
1248085586516328448,MagnoMalta,CLOROQUINA FOI UMA CONTRIBUIÇÃO DE DORIA PARA O BRASIL ! TROFÉU ÓLEO DE PEROBA PRA ELE https://t.co/V11At2nxFK
1255604532693864452,folha,"Antiviral remdesivir acelera recuperação de pacientes com Covid-19, diz órgão dos EUA https://t.co/olOgNXcZjD"
1255601408126181378,Ro_anna,"PROMOÇÃO 

O GERENTE ENDOIDOU 

Ministro Guedes quer a venda de estatais e imóveis da União nesse momento de pandemia 
https://t.co/7fxczBRGN1"
1255588963831689218,delucca,"Vocês lembram que Bolsonaro disse que mandou o Laboratório do Exército fabricar cloroquina desesperadamente, mesmo sem saber se ele era eficaz contra o coronavírus? Pois é, agora estão produzindo 80 vezes mais e Bolsonaro nem fala mais sobre o assunto.

https://t.co/uzYW7Adl3r"
1255541788154224641,NBCNews,"Dr. Fauci speaks on the clinical trial for potential coronavirus treatment drug remdesivir:

“What it has proven is that a drug can block this virus ... This drug happens to be blocking an enzyme that the virus uses."" https://t.co/hFTPUIa8No"
1255600321579098113,teixei_a,"@perolingrado @sandra_miria Que viajem, o que será que ele tomou?"
1255521119458799617,BolsonaroSP,"Confira algumas das medidas tomadas pelo Presidente @jairbolsonaro nos últimos dias, tanto no esforço contra a pandemia quanto em outros setores da sociedade 👍 https://t.co/uIMxiKWifG"
1255523501613682690,danimontpsol,"Presidente: Ministro Nelson Teich vai recomendar retomada de jogos de futebol.
Os estádios de futebol: https://t.co/rFLb0UyiAc"
1255572698123472901,YahooBr,"Brasil tem maior taxa de contágio por coronavírus do mundo, aponta estudo https://t.co/VwS454Idfz"
1255583884290465793,g1,Bolsonaro diz que governadores e prefeitos devem ser cobrados por mortes e critica isolamento com declaração que vai na contramão de estudos científicos =&gt; https://t.co/FI1L1JOMmj #G1 https://t.co/jye9SOPUNO
1255492982389735430,paulomoreria,"quarentena dia 45: se tivesse que por um nome de remédio pro teu filho/filha, que nome tu escolheria?"
1255564978511319040,oatila,"Se faltam equipamentos de proteção, precisam trabalhar em péssimas condições, se afastar da família, arriscar a vida e quando olham pra fora vêem a displicência com que todos os outros tratam de COVID-19 e o desprezo pelo trabalho deles, fica cada vez mais difícil trabalharem. https://t.co/KYszxsSXIl"
1255483821698490370,GeorgMarques,"Jornalistas que debocharam e criticaram eficácia do isolamento social deram positivo para o covid19: Sikêra Jr e Caio Coppolla, ambos abraçaram a narrativa anticiência e mortífera de Bolsonaro. Agora estão isolados tratando da doença. Espero que se recuperem e aprendam a lição. https://t.co/Vm4Ek3LVxk"
1255590313613238274,MarceloPintoBA,"Produção de cloroquina pelo Exército aumenta 80 vezes, mesmo sem conclusão de sua eficácia contra a covid-19 via @elpais_brasil https://t.co/uHgzQXOFWO"
1255568410802630657,minc_rj,"BolsoVirus rejeita pedido de ajuda dos Agentes Funerários de Manaus. Não é comigo. E daí? Não sou coveiro. É sim o coveiro da Democracia e da Nação. Não é solidário aos profissionais da Saúde e aos bravos agentes funerários. Renuncie deste governo medíocre, insano tirano.! https://t.co/pTdoUfbno2"
1255487266199306242,CarlaPola,"As mortes por Coronavírus estão na tua conta sim, @jairbolsonaro.

Mau exemplo e indiferença, fez com que muitas pessoas saíssem do isolamento e muitas já estão morrendo, seu lixo sociopata.

“Não adianta a imprensa botar na minha conta essas questões, que não cabem a mim”"
1255588963831689218,delucca,"Vocês lembram que Bolsonaro disse que mandou o Laboratório do Exército fabricar cloroquina desesperadamente, mesmo sem saber se ele era eficaz contra o coronavírus? Pois é, agora estão produzindo 80 vezes mais e Bolsonaro nem fala mais sobre o assunto.

https://t.co/uzYW7Adl3r"
1255588963831689218,delucca,"Vocês lembram que Bolsonaro disse que mandou o Laboratório do Exército fabricar cloroquina desesperadamente, mesmo sem saber se ele era eficaz contra o coronavírus? Pois é, agora estão produzindo 80 vezes mais e Bolsonaro nem fala mais sobre o assunto.

https://t.co/uzYW7Adl3r"
1255586271063420931,VictorGonz_77,@wilsonwitzel https://t.co/OrywrO4Wvu
1255549494667640834,MinEconomia,"“O Brasil tem ativos imobiliários que chegam a mais de R$ 1 trilhão de valor. Se acelerarmos a venda de imóveis, podemos reduzir bastante a dívida pública”, defende o ministro Paulo Guedes .Saiba mais: https://t.co/TSAtqMHKSK https://t.co/lSFp6cbnUs"
1248646427150110728,allantercalivre,"@allantercalivre's account has been withheld in Brazil, Worldwide in response to a legal demand. Learn more."
1255580013392470021,apyus,Jair Bolsonaro prometia não passar de 800 mortes. Já perdemos mais de 5 mil brasileiros. https://t.co/8HUzqwhmBh
